<?xml version="1.0" encoding="UTF-8" standalone="no" ?>
<!DOCTYPE macros SYSTEM "http://www.4d.com/dtd/2007/macros.dtd" >

<!--
    4DPop macros - [FR]
    vincent@de-lachaux.net
-->

<macros>
    
    <!-- ******************************* OUTILS ******************************* -->
    <macro name="-" in_menu="true" type_ahead="false"><text/></macro>
    
    <macro name="Test Macro/0" 
        in_menu="true" 
        type_ahead="false" 
        version="2">        
        <text><method>4DPop_TEST_Macros</method></text>        
    </macro>
    
    <macro name="Rejouer la dernière macro exécutée" 
        in_menu="true" 
        type_ahead="false" 
        version="2">        
        <text><method>_runMacro</method></text>        
    </macro>
    
    <macro name="Déclarations.../$" 
        in_menu="true" 
        type_ahead="false" 
        version="2">
        <text><method>_runMacro("Declarations";"<method_path/>")</method></text>        
    </macro>
    
    <macro name="Directive de compilation… /¢" 
        in_menu="true" 
        type_ahead="false" 
        version="2">
        <text><method>_runMacro("compiler_directive")</method></text>
    </macro>
    
    <macro name="Valeur de la constante…" 
        in_menu="true" 
        type_ahead="false" 
        version="2">
        <text><method>_runMacro("constantValue")</method></text>
    </macro>
    
    <macro name="Chercher avec Google" 
        in_menu="true" 
        type_ahead="false" 
        version="2">
        <text><method>_runMacro("googleSearch")</method></text>
    </macro>
    
    <macro name="Faire une archive" 
        in_menu="true" 
        type_ahead="false" 
        version="2">
        <text><method>_runMacro("zipForShare")</method></text>
    </macro>
    
    <!-- ******************************* METHODS ******************************* -->
    <macro name="-" in_menu="true" type_ahead="false"><text/></macro>
    
    <macro name="Nouvelle méthode…/…" 
        in_menu="true" 
        type_ahead="true" 
        type_ahead_text="_method" 
        version="2">        
        <text><method>_runMacro("method-new")</method></text>        
    </macro>
    
    <macro name="Attributs de la méthode…" 
        in_menu="true" 
        type_ahead="true" 
        type_ahead_text="_attributes" 
        version="2">        
        <text><method>_runMacro("method-attributes";"<method_path/>")</method></text>        
    </macro>
    
    <macro name="Beautifier/§" 
        in_menu="true" 
        type_ahead="false" 
        version="2">        
        <text><method>_runMacro("Beautifier")</method></text>        
    </macro>
    
    <macro name="Supprimer les lignes vides/*" 
        in_menu="true" 
        type_ahead="false" 
        version="2">        
        <text><method>_runMacro("RemoveBlankLines")</method></text>        
    </macro>
    
    <!-- ******************************* COPIER COLLER ******************************* -->
    <macro name="-" in_menu="true" type_ahead="true" type_ahead_text="Scomber scombrus : lol">
        <text><method>_runMacro("about")</method></text>
    </macro>
    
    <macro name="Copie avec tokens"
        in_menu="true"
        type_ahead="false"
        version="2">
        <text><method>_runMacro("CopyWithTokens")</method></text>
    </macro>
    
    <macro name="Copier et Remplacer/©" 
        in_menu="true" 
        type_ahead="false" 
        version="2">        
        <text><method>_runMacro("PasteAndKeepTarget")</method></text>        
    </macro>
    
    <macro name="Collage spécial.../◊" 
        in_menu="true" 
        type_ahead="true" 
        type_ahead_text="_p" 
        version="2">        
        <text><method>_runMacro("SpecialPaste")</method></text>        
    </macro>
    
    <macro name="Coller une couleur" 
        in_menu="true" 
        type_ahead="true" 
        type_ahead_text="_c" 
        version="2">        
        <text><method>_runMacro("PasteColor")</method></text>        
    </macro>  
    
    <!-- ******************************* COMMENTAIRES ******************************* -->
    <macro name="-" in_menu="true" type_ahead="true" type_ahead_text="4d macro">
        <text>Maquereau 4D : <caret/></text>        
    </macro>
    
    <macro name="Commenter/j"
        in_menu="true"
        type_ahead="false"
        version="2">
        <text><method>_runMacro("comment")</method></text>
    </macro>
    
    <macro name="Dupliquer et commenter/∂" 
        in_menu="true" 
        type_ahead="false" 
        version="2">        
        <text><method>_runMacro("duplicateAndComment")</method></text>    
    </macro>
    
    <!-- ******************************* REFACTORING ******************************* -->
    <macro name="-" type_ahead="false"><text/></macro>
    
    <macro name="Assertion conditionelle/æ" 
        in_menu="true" 
        type_ahead="false" 
        version="2">
        <text><method>_runMacro("Asserted")</method></text>
    </macro>
    
    <macro name="Convertir en appel avec token" 
        in_menu="true" 
        type_ahead="false" 
        version="2">
        <text><method>_runMacro("ConvertToCallWithToken")</method></text>
    </macro>
    
    <macro name="Notation à point" 
        in_menu="true" 
        type_ahead="false" 
        version="2">
        <text><method>_runMacro("dot_notation")</method></text>
    </macro>
    
    <macro name="Choisir" 
        in_menu="true" 
        type_ahead="false" 
        version="2">        
        <text><method>_runMacro("Choose")</method></text>        
    </macro>
    
    <macro name="EXECUTER METHODE" 
        in_menu="true" 
        type_ahead="false" 
        version="2">        
        <text><method>_runMacro("convert_to_execute")</method></text>        
    </macro>
    
    <macro name="EXECUTER FORMULE" 
        in_menu="true" 
        type_ahead="false" 
        version="2">        
        <text><method>_runMacro("convert_to_formula")</method></text>        
    </macro> 
       
    <!-- ******************************* CONVERSIONS ******************************* -->
    <macro name="-" in_menu="true" type_ahead="true" type_ahead_text="Maquereau 4D : mdr">
        <text>Scomber scombrus : <caret/></text>
    </macro>
    
    <macro name="Convertir en Hexa" 
        in_menu="true" 
        type_ahead="false" 
        version="2">        
        <text><method>_runMacro("convert_hexa")</method></text>        
    </macro>
    
    <macro name="Convertir en decimal" 
        in_menu="true" 
        type_ahead="false" 
        version="2">        
        <text><method>_runMacro("convert_decimal")</method></text>        
    </macro>
    
    <macro name="-"  in_menu="true" type_ahead="false"><text/></macro>
    
    <macro name="Expression inverse" 
        in_menu="true" 
        type_ahead="false" 
        version="2">        
        <text><method>_runMacro("invert_expression")</method></text>        
    </macro>

    <macro name="-"  in_menu="true" type_ahead="false"><text/></macro>
        
</macros>
