<?xml version="1.0" encoding="UTF-8" standalone="no" ?>
<!DOCTYPE macros SYSTEM "http://www.4d.com/dtd/2007/macros.dtd" >

<!--
    4DPop macros - [EN]
    vincent@de-lachaux.net
-->

<macros>
    
    <!-- ******************************* TOOLS ******************************* -->
    <macro name="-" in_menu="true" type_ahead="false"><text/></macro>
    
    <macro name="Macro test/0" 
        in_menu="true" 
        type_ahead="false" 
        version="2">
        <text><method>4DPop_TEST_Macros</method></text>
    </macro>
    
    <macro name="Replay the last macro run" 
        in_menu="true" 
        type_ahead="false" 
        version="2">
        <text><method>_runMacro</method></text>
    </macro>
    
    <macro name="Declarations.../$" 
        in_menu="true" 
        type_ahead="false" 
        version="2">
        <text><method>_runMacro("Declarations";"<method_path/>")</method></text>
    </macro>
    
    <macro name="Compiler directive… /¢" 
        in_menu="true" 
        type_ahead="false" 
        version="2">
         <text><method>_runMacro("compiler_directive")</method></text>
    </macro>
    
    <macro name="Constant value…" 
        in_menu="true" 
        type_ahead="false" 
        version="2">
        <text><method>_runMacro("constantValue")</method></text>
    </macro>
    
    <macro name="Find with Google" 
        in_menu="true" 
        type_ahead="false" 
        version="2">
        <text><method>_runMacro("googleSearch")</method></text>
    </macro>
    
    <macro name="Make an archive" 
        in_menu="true" 
        type_ahead="false" 
        version="2">
        <text><method>_runMacro("zipForShare")</method></text>
    </macro>
    
    <!-- ******************************* METHODS ******************************* -->
    <macro name="-" in_menu="true" type_ahead="false"><text/></macro>
        
    <macro name="New method…/…" 
        in_menu="true" 
        type_ahead="true" 
        type_ahead_text="_method" 
        version="2">        
        <text><method>_runMacro("method-new")</method></text>        
    </macro>
        
    <macro name="Method attributes…" 
        in_menu="true" 
        type_ahead="true" 
        type_ahead_text="_attributes" 
        version="2">        
        <text><method>_runMacro("method-attributes";"<method_path/>")</method></text>        
    </macro>
        
    <macro name="Beautifier/§" 
        in_menu="true" 
        type_ahead="false" 
        version="2">        
        <text><method>_runMacro("Beautifier")</method></text>        
    </macro>
    
    <macro name="Remove blank lines/*" 
        in_menu="true" 
        type_ahead="false" 
        version="2">        
        <text><method>_runMacro("RemoveBlankLines")</method></text>        
    </macro>
    
    <!-- ******************************* COPY PASTE ******************************* -->
    <macro name="-" in_menu="true" type_ahead="true" type_ahead_text="Scomber scombrus : lol">
        <text><method>_runMacro("about")</method></text>
    </macro>
    
    <macro name="Copy with tokens"
        in_menu="true"
        type_ahead="false"
        version="2">
        <text><method>_runMacro("CopyWithTokens")</method></text>
    </macro>
    
    <macro name="Copy and replace/©" 
        in_menu="true" 
        type_ahead="false" 
        version="2">
        <text><method>_runMacro("PasteAndKeepTarget")</method></text>
    </macro>
    
    <macro name="Special paste.../◊" 
        in_menu="true" 
        type_ahead="true" 
        type_ahead_text="_p"
        version="2">
        <text><method>_runMacro("SpecialPaste")</method></text>
    </macro>
    
    <macro name="Past a color expression" 
        in_menu="true" 
        type_ahead="true" 
        type_ahead_text="_c"
        version="2">
        <text><method>_runMacro("PasteColor")</method></text>
    </macro>
    
    <!-- ******************************* COMMENTS ******************************* -->
    <macro name="-" in_menu="true" type_ahead="true" type_ahead_text="4d macro">
        <text>Maquereau 4D : <caret/></text>        
    </macro>

    <macro name="Comments/j"
        in_menu="true"
        type_ahead="false"
        version="2">
        <text><method>_runMacro("comment")</method></text>
    </macro>
    
    <macro name="Duplicate and comment/∂"
        in_menu="true"
        type_ahead="false"
        version="2">
        <text><method>_runMacro("duplicateAndComment")</method></text>
    </macro>
    
    <!-- ******************************* REFACTORING ******************************* -->
    <macro name="-" type_ahead="false"><text/></macro>
    
    <macro name="Conditional assertion/æ" 
        in_menu="true" 
        type_ahead="false" 
        version="2">
        <text><method>_runMacro("Asserted")</method></text>
    </macro>
    
    <macro name="Convert to call with token" 
        in_menu="true" 
        type_ahead="false" 
        version="2">
        <text><method>_runMacro("ConvertToCallWithToken")</method></text>
    </macro>
    
    <macro name="Dot notation" 
        in_menu="true" 
        type_ahead="false" 
        version="2">
        <text><method>_runMacro("dot_notation")</method></text>
    </macro>
    
    <macro name="Choose" 
        in_menu="true" 
        type_ahead="false" 
        version="2">        
        <text><method>_runMacro("Choose")</method></text>        
    </macro>
    
    <macro name="EXECUTE METHOD" 
        in_menu="true" 
        type_ahead="false" 
        version="2">        
        <text><method>_runMacro("convert_to_execute")</method></text>        
    </macro>
    
    <macro name="EXECUTE FORMULA" 
        in_menu="true" 
        type_ahead="false" 
        version="2">        
        <text><method>_runMacro("convert_to_formula")</method></text>        
    </macro>
        
    <!-- ******************************* CONVERSIONS ******************************* -->
    <macro name="-" in_menu="true" type_ahead="true" type_ahead_text="Maquereau 4D : mdr">
        <text>Scomber scombrus : <caret/></text>
    </macro>
    
    <macro name="Convert to Hexa" 
        in_menu="true" 
        type_ahead="false" 
        version="2">
        <text><method>_runMacro("convert_hexa")</method></text>
    </macro>
    
    <macro name="Convert to decimal" 
        in_menu="true" 
        type_ahead="false" 
        version="2">
        <text><method>_runMacro("convert_decimal")</method></text>
    </macro>
    
    <macro name="-" type_ahead="false"><text/></macro>
    
    <macro name="Invert expression" 
        in_menu="true" 
        type_ahead="false" 
        version="2">
        <text><method>_runMacro("invert_expression")</method></text>
    </macro>
    
    <macro name="-"  in_menu="true" type_ahead="false"><text/></macro>
    
</macros>
